{
  "schema_version": 1,
  "message_id": "018cc251-f400-7a88-8000-000000000031",
  "site_id": "workshop-demo",
  "device_id": "motor-01",
  "sequence": 49,
  "device_time": "2026-08-11T08:01:10Z",
  "event_code": "VIBRATION_WARNING",
  "severity": "warning",
  "state": "active",
  "summary": "Vibration RMS crossed the configured warning threshold.",
  "synthetic": true,
  "details": {"value_mps2": 4.8, "threshold_mps2": 4.5}
}

